{
  "schema_version": "1.0.0",
  "last_updated": "2026-09-26",
  "reviewed_plan_paths": [
    "data/plans/2026-08-performance-v1.json",
    "data/plans/2026-08-performance-v2.json",
    "data/plans/2026-09-training-v1.json",
    "data/plans/2026-09-training-v1-1.json"
  ],
  "sessions": [
    {
      "plan_id": "performance_2026_08_v1",
      "plan_version": "1.0.0",
      "session_id": "lower_a",
      "assignment_role": "main",
      "compatible_preparation_session_ids": []
    },
    {
      "plan_id": "performance_2026_08_v1",
      "plan_version": "1.0.0",
      "session_id": "upper_a",
      "assignment_role": "main",
      "compatible_preparation_session_ids": []
    },
    {
      "plan_id": "performance_2026_08_v1",
      "plan_version": "1.0.0",
      "session_id": "lower_b",
      "assignment_role": "main",
      "compatible_preparation_session_ids": []
    },
    {
      "plan_id": "performance_2026_08_v1",
      "plan_version": "1.0.0",
      "session_id": "lower_b_microdose",
      "assignment_role": "main",
      "compatible_preparation_session_ids": []
    },
    {
      "plan_id": "performance_2026_08_v1",
      "plan_version": "1.0.0",
      "session_id": "upper_b",
      "assignment_role": "main",
      "compatible_preparation_session_ids": []
    },
    {
      "plan_id": "performance_2026_08_v1",
      "plan_version": "1.0.0",
      "session_id": "pre_footvolley_warmup",
      "assignment_role": "preparation",
      "compatible_preparation_session_ids": []
    },
    {
      "plan_id": "performance_2026_08_v2",
      "plan_version": "2.1.0",
      "session_id": "lower_a",
      "assignment_role": "main",
      "compatible_preparation_session_ids": [
        "pre_lower_warmup"
      ]
    },
    {
      "plan_id": "performance_2026_08_v2",
      "plan_version": "2.1.0",
      "session_id": "upper_a",
      "assignment_role": "main",
      "compatible_preparation_session_ids": [
        "pre_upper_warmup"
      ]
    },
    {
      "plan_id": "performance_2026_08_v2",
      "plan_version": "2.1.0",
      "session_id": "lower_b",
      "assignment_role": "main",
      "compatible_preparation_session_ids": [
        "pre_lower_warmup"
      ]
    },
    {
      "plan_id": "performance_2026_08_v2",
      "plan_version": "2.1.0",
      "session_id": "lower_b_microdose",
      "assignment_role": "main",
      "compatible_preparation_session_ids": [
        "pre_lower_warmup"
      ]
    },
    {
      "plan_id": "performance_2026_08_v2",
      "plan_version": "2.1.0",
      "session_id": "upper_b",
      "assignment_role": "main",
      "compatible_preparation_session_ids": [
        "pre_upper_warmup"
      ]
    },
    {
      "plan_id": "performance_2026_08_v2",
      "plan_version": "2.1.0",
      "session_id": "pre_upper_warmup",
      "assignment_role": "preparation",
      "compatible_preparation_session_ids": []
    },
    {
      "plan_id": "performance_2026_08_v2",
      "plan_version": "2.1.0",
      "session_id": "pre_lower_warmup",
      "assignment_role": "preparation",
      "compatible_preparation_session_ids": []
    },
    {
      "plan_id": "performance_2026_08_v2",
      "plan_version": "2.1.0",
      "session_id": "pre_footvolley_warmup",
      "assignment_role": "preparation",
      "compatible_preparation_session_ids": []
    },
    {
      "plan_id": "training_2026_09_v1",
      "plan_version": "1.0.0",
      "session_id": "t1",
      "assignment_role": "main",
      "compatible_preparation_session_ids": [
        "pre_t1"
      ]
    },
    {
      "plan_id": "training_2026_09_v1",
      "plan_version": "1.0.0",
      "session_id": "t2",
      "assignment_role": "main",
      "compatible_preparation_session_ids": [
        "pre_t2"
      ]
    },
    {
      "plan_id": "training_2026_09_v1",
      "plan_version": "1.0.0",
      "session_id": "t3",
      "assignment_role": "main",
      "compatible_preparation_session_ids": [
        "pre_t3"
      ]
    },
    {
      "plan_id": "training_2026_09_v1",
      "plan_version": "1.0.0",
      "session_id": "pre_t1",
      "assignment_role": "preparation",
      "compatible_preparation_session_ids": []
    },
    {
      "plan_id": "training_2026_09_v1",
      "plan_version": "1.0.0",
      "session_id": "pre_t2",
      "assignment_role": "preparation",
      "compatible_preparation_session_ids": []
    },
    {
      "plan_id": "training_2026_09_v1",
      "plan_version": "1.0.0",
      "session_id": "pre_t3",
      "assignment_role": "preparation",
      "compatible_preparation_session_ids": []
    },
    {
      "plan_id": "training_2026_09_v1",
      "plan_version": "1.0.0",
      "session_id": "pre_footvolley",
      "assignment_role": "preparation",
      "compatible_preparation_session_ids": []
    },
    {
      "plan_id": "training_2026_09_v1",
      "plan_version": "1.1.0",
      "session_id": "t1",
      "assignment_role": "main",
      "compatible_preparation_session_ids": [
        "pre_t1"
      ]
    },
    {
      "plan_id": "training_2026_09_v1",
      "plan_version": "1.1.0",
      "session_id": "t2",
      "assignment_role": "main",
      "compatible_preparation_session_ids": [
        "pre_t2"
      ]
    },
    {
      "plan_id": "training_2026_09_v1",
      "plan_version": "1.1.0",
      "session_id": "t3",
      "assignment_role": "main",
      "compatible_preparation_session_ids": [
        "pre_t3"
      ]
    },
    {
      "plan_id": "training_2026_09_v1",
      "plan_version": "1.1.0",
      "session_id": "pre_t1",
      "assignment_role": "preparation",
      "compatible_preparation_session_ids": []
    },
    {
      "plan_id": "training_2026_09_v1",
      "plan_version": "1.1.0",
      "session_id": "pre_t2",
      "assignment_role": "preparation",
      "compatible_preparation_session_ids": []
    },
    {
      "plan_id": "training_2026_09_v1",
      "plan_version": "1.1.0",
      "session_id": "pre_t3",
      "assignment_role": "preparation",
      "compatible_preparation_session_ids": []
    },
    {
      "plan_id": "training_2026_09_v1",
      "plan_version": "1.1.0",
      "session_id": "pre_footvolley",
      "assignment_role": "preparation",
      "compatible_preparation_session_ids": []
    }
  ],
  "exercises": [
    {
      "exercise_id": "snap_down_stick",
      "measurement_type": "repetitions",
      "load_applicable": false,
      "load_unit": null,
      "normalization_rule": {
        "prescriptions": [
          {
            "source_text": "3",
            "minimum": 3,
            "maximum": 3,
            "unit": "repetitions",
            "scope": "total",
            "qualifier": null
          }
        ]
      }
    },
    {
      "exercise_id": "jump_squat",
      "measurement_type": "repetitions",
      "load_applicable": true,
      "load_unit": "kg",
      "normalization_rule": {
        "prescriptions": [
          {
            "source_text": "3",
            "minimum": 3,
            "maximum": 3,
            "unit": "repetitions",
            "scope": "total",
            "qualifier": null
          }
        ]
      }
    },
    {
      "exercise_id": "loaded_squat",
      "measurement_type": "repetitions",
      "load_applicable": true,
      "load_unit": "kg",
      "normalization_rule": {
        "prescriptions": [
          {
            "source_text": "4-6",
            "minimum": 4,
            "maximum": 6,
            "unit": "repetitions",
            "scope": "total",
            "qualifier": null
          }
        ]
      }
    },
    {
      "exercise_id": "romanian_deadlift",
      "measurement_type": "repetitions",
      "load_applicable": true,
      "load_unit": "kg",
      "normalization_rule": {
        "prescriptions": [
          {
            "source_text": "5-8",
            "minimum": 5,
            "maximum": 8,
            "unit": "repetitions",
            "scope": "total",
            "qualifier": null
          }
        ]
      }
    },
    {
      "exercise_id": "nordic_hamstring",
      "measurement_type": "repetitions",
      "load_applicable": false,
      "load_unit": null,
      "normalization_rule": {
        "prescriptions": [
          {
            "source_text": "4-6",
            "minimum": 4,
            "maximum": 6,
            "unit": "repetitions",
            "scope": "total",
            "qualifier": null
          }
        ]
      }
    },
    {
      "exercise_id": "standing_calf_raise",
      "measurement_type": "repetitions",
      "load_applicable": true,
      "load_unit": "kg",
      "normalization_rule": {
        "prescriptions": [
          {
            "source_text": "6-10",
            "minimum": 6,
            "maximum": 10,
            "unit": "repetitions",
            "scope": "total",
            "qualifier": null
          },
          {
            "source_text": "8",
            "minimum": 8,
            "maximum": 8,
            "unit": "repetitions",
            "scope": "total",
            "qualifier": null
          },
          {
            "source_text": "10",
            "minimum": 10,
            "maximum": 10,
            "unit": "repetitions",
            "scope": "total",
            "qualifier": null
          }
        ]
      }
    },
    {
      "exercise_id": "seated_calf_raise",
      "measurement_type": "repetitions",
      "load_applicable": true,
      "load_unit": "kg",
      "normalization_rule": {
        "prescriptions": [
          {
            "source_text": "8-12",
            "minimum": 8,
            "maximum": 12,
            "unit": "repetitions",
            "scope": "total",
            "qualifier": null
          }
        ]
      }
    },
    {
      "exercise_id": "pallof_press",
      "measurement_type": "per_side",
      "load_applicable": true,
      "load_unit": "kg",
      "normalization_rule": {
        "prescriptions": [
          {
            "source_text": "8-12_each_side",
            "minimum": 8,
            "maximum": 12,